dataset_name,duration_hours,language,description,license,url
LibriSpeech,"~1,000","English","Large-scale corpus of read English speech from LibriVox audiobooks, 16kHz, segmented and aligned. Widely used ASR benchmark.",CC BY 4.0,https://www.openslr.org/12/
Common Voice (Mozilla) v19,"~30,000+ validated","130+ languages","Crowdsourced multilingual speech dataset. Volunteers read sentences; community-validated. Largest open multilingual speech corpus by language count.",CC-0 (public domain),https://commonvoice.mozilla.org/en/datasets
GigaSpeech,"~10,000","English","Multi-domain English speech corpus from audiobooks, podcasts, and YouTube. Includes punctuated transcriptions. Designed for ASR and beyond.",Apache 2.0,https://github.com/SpeechColab/GigaSpeech
Emilia,"~101,000","6 languages (EN/ZH/DE/FR/JA/KO)","Large-scale multilingual in-the-wild speech dataset for speech generation (TTS). Diverse speaking styles from real-world sources. Includes Emilia-Pipe preprocessing pipeline.",CC-BY-NC-4.0 (Emilia) / CC-BY-4.0 (Emilia-YODAS),https://huggingface.co/datasets/amphion/Emilia-Dataset
VoxPopuli,"~400,000 unlabelled; ~1,800 transcribed","23 EU languages","Large-scale multilingual speech corpus from European Parliament recordings. Includes unlabelled audio and transcribed subsets for ASR and speech translation.",CC-0 (public domain),https://github.com/facebookresearch/voxpopuli
